{
  "id": "Version",
  "description": "Returns the version number of the installed packages",
  "service": {
    "readOnly": true,
    "routerBase": "/core/version/",
    "parent": "graviton.swagger.controller.version",
    "baseController": "\\Graviton\\SwaggerBundle\\Controller\\SwaggerController"
  },
  "target": {
    "indexes": [],
    "relations": [],
    "fields": [
      {
        "name": "versions",
        "type": "object",
        "title": "versions",
        "description": "holds package version numbers"
      }
    ]
  }
}
