{
    "id": "Showcase",
    "description": "A service showcasing all of our generator features",
    "service": {
        "readOnly": false,
        "baseController": "\\Graviton\\CoreBundle\\Controller\\ShowcaseExtensionController",
        "routerBase": "/hans/showcase/",
        "fixtures": {
            "": [
                {
                    "id": 5,
                    "anotherInt": 655,
                    "testField": {"en": "a string value"},
                    "someOtherField": {"en": "some ol' string"},
                    "aBoolean": false,
                    "modificationDate": "1984-05-02T00:00:00Z"
                }
            ],
            "contactCode": [
                {
                    "someDate": "1979-12-21T00:00:00Z",
                    "text": {"en": "Dudi"}
                }
            ]
        }
    },
    "target": {
        "indexes": [],
        "relations": [],
        "fields": [
            {
                "name": "id",
                "type": "INT",
                "description": "Unique identifier for an item."
            },
            {
                "name": "anotherInt",
                "type": "INT",
                "description": "Just a nice integer",
                "required": true
            },
            {
                "name": "testField",
                "type": "varchar",
                "title": "A testing title",
                "description": "A lengthy and detailed description.",
                "required": true,
                "translatable": true
            },
            {
                "name": "someOtherField",
                "type": "varchar",
                "title": "Another field",
                "description": "A very nice field",
                "translatable": true
            },
            {
                "name": "aBoolean",
                "type": "boolean",
                "title": "Some boolean",
                "description": "Everybody likes a good ol' bool",
                "required": true
            },
            {
                "name": "modificationDate",
                "type": "datetime",
                "title": "An important date",
                "description": "Don't forget to save the date"
            },
            {
                "name": "contact",
                "type": "class:Graviton\\PersonBundle\\Document\\PersonContact",
                "title": "A single contact element",
                "description": "How to contact someone..",
                "required": false
            },
            {
                "name": "contacts",
                "type": "class:Graviton\\PersonBundle\\Document\\PersonContact[]",
                "title": "An array of contact elements..",
                "description": "Other ways to contact someone.."
            },
            {
                "name": "contactCode.someDate",
                "type": "datetime",
                "title": "Another datetime",
                "description": "Who doesn't like a datetime??"
            },
            {
                "name": "contactCode.text",
                "type": "varchar",
                "translatable": true,
                "required": true,
                "title": "Meaning of the code",
                "description": "Some text to the code.."
            },
            {
                "name": "nestedArray.0.name",
                "type": "varchar",
                "title": "Name of nested array",
                "description": "Some text"
            }
        ]
    }
}
